"performance_area","benchmark_type","target_value","measurement_unit","measurement_conditions","test_environment","load_profile","monitoring_tools","baseline_value","acceptable_range","alert_threshold","degradation_trend","improvement_opportunities","business_relevance"
"Interactive API Response Time","Response Time","250","milliseconds","95th Percentile (p95) under nominal load","Staging (Mirror of Prod)","1000 concurrent users performing read/write operations","Prometheus, Grafana, k6","150","100-400ms","400","Increasing latency > 10% week-over-week","Redis caching for user profiles and project lists","Critical for user experience and perception of platform speed"
"AI SOW Processing Time","Throughput","60","seconds","Average time from Upload to 'Ready for Review' for 5MB PDF","Staging","10 concurrent document uploads","CloudWatch (Lambda/SQS metrics), OpenTelemetry","45","30-120s","120","Processing time exceeding 90s consistently","Optimize OCR resolution; Parallelize PII redaction and Extraction","Directly impacts Admin efficiency and workflow blocking"
"Vector Search Latency (Vendor Matching)","Response Time","300","milliseconds","p95 latency for searching against 10,000 vendor profiles","Staging with seeded DB","50 concurrent search requests","PostgreSQL Slow Query Log, pg_stat_statements","150","100-500ms","500","Linear increase with vendor count indicates indexing failure","Tune HNSW index parameters (m, ef_construction)","Critical for real-time vendor recommendation UI"
"Frontend Core Web Vitals (LCP)","Response Time","2.5","seconds","Largest Contentful Paint on Dashboard & Project Views over 4G","Production / Lighthouse CI","Simulated Fast 3G Network","Lighthouse, Vercel Analytics","1.8","< 2.5s","3","LCP increasing after UI component updates","Implement aggressive code splitting; Optimistic UI updates; Image optimization","SEO and user retention; Compliance with REQ-PERF-002"
"Webhook Processing Throughput","Throughput","100","requests per second","Max throughput for Stripe/Wise webhook ingestion","Load Test Env","Burst traffic simulation (e.g., end-of-month payments)","AWS SQS metrics, Lambda concurrency metrics","50","N/A (Higher is better)","10","Queue depth growth > processing rate","Increase Lambda concurrency limits; Batch processing SQS messages","Ensures financial consistency during high-volume periods"