"task_id","task_name","primary_skill","secondary_skills","complexity_level","estimated_hours","required_experience","productivity_factor","adjusted_hours","team_size","collaboration_required","dependencies","critical_path","skill_learning_curve","ramp_up_hours","resource_notes","alternative_approach","risk_factors","mitigation_strategy","quality_overhead","review_hours","documentation_hours","testing_coordination","integration_overhead"
"TASK-INFRA-001.1","VPC Network Architecture Design & Implementation","DevOps & Infrastructure","Terraform,AWS Networking","Medium","5.2","Senior","1.2","4.3","1","true","None","true","None","","Foundation for all infrastructure; requires precise CIDR planning","Use default VPC (Not recommended for prod)","Security Group misconfiguration","Peer review of Terraform plan","0.8","0.5","0.5","1","0.5"
"TASK-INFRA-001.2","EKS Control Plane & Node Group Configuration","DevOps & Infrastructure","Kubernetes,AWS IAM,Terraform","High","10.3","Senior","1.2","8.6","1","","TASK-INFRA-001.1","true","Low","1","Complex IRSA configuration required","Use Fargate profiles (Higher cost)","EKS version compatibility issues","Pin module versions","1.5","1","1","2","1"
"TASK-AUTH-001.1","JWT Strategy Implementation","Backend Development","NestJS,Passport.js,Security","Medium","6","Senior","1.3","4.6","1","","None","true","None","","Core security component; requires deep Passport.js knowledge","Custom middleware (Higher risk)","Token validation logic flaws","Comprehensive unit testing with mock tokens","1","0.6","0.4","1","0.5"
"TASK-AI-002.1","Worker Service Scaffold & SQS Consumer","Backend Development","Python,SQS,Docker","Medium","6","Mid","1","6","1","true","None","","Low","2","Requires coordination with DevOps for SQS permissions","Lambda functions (Timeout risks)","Message processing idempotency","Implement rigorous ACK/NACK logic","1","0.6","0.4","1","1"
"TASK-FIN-002.1","Wise API Client Wrapper","Backend Development","NestJS,Axios,Financial APIs","Medium","10","Senior","1.3","7.7","1","","None","","Medium","2","Requires Wise Sandbox API understanding","Direct HTTP calls (Low maintainability)","API rate limits or schema changes","Implement retry logic and typed response interfaces","1.5","1","1","2","1"